Begründetheit (Einleitungssatz),"Die Verfassungsbeschwerde ist begründet, wenn der angefochtene Hoheitsakt den Beschwerdeführer in seinen Grundrechten bzw. grundrechtsgleichen Rechten (siehe Art. 93 I Nr. 4a GG) verletzt."
Klassischer Eingriffsbegriff,"Eingriff ist ein staatlicher Rechtsakt, der final, unmittelbar und imperativ ein Grundrecht beeinträchtigt."
Moderner Eingriffsbegriff,"Eingriff ist jede staatliche Maßnahme, die das grundrechtlich geschützte Verhalten ganz oder teilweise unmöglich macht."
Legitimer Zweck,"Zwecke, die auf das Wohl der Allgemeinheit gerichtet sind."
Geeignetheit,"Tauglich, die Zweckerreichung zu fördern"
Erforderlichkeit,Kein gleich geeignetes milderes Mittel
Angemessenheit,Angemessenes Verhältnis zwischen grundrechts-beschränkender Maßnahme und verfolgtem Zweck
